[
    {"id": "1",
     "headline": "Computational Legal Studies Workshop 2025 (CLS 2025) ", 
     "content": "Our lab presented a paper at CLS 2025", 
     "date": "2025-09-09"},
    {"id": "2",
     "headline": "Environmental Law & Governance Seminar", 
     "content": "Our lab hosted the Miin Wu School Seminar on Environmental Law and Sustainability Governance, featuring a keynote lecture by Prof. Jiunn-Rong Yeh, with Prof. Hsiao-Wen Wang serving as the discussant and Prof. Shao-Man Lee as the moderator.", 
     "date": "2025-11-21"},
     {"id": "3",
     "headline": "International Conference on Emerging Infectious Diseases 2025 (ICEID 2025)", 
     "content": "Our lab presented a poster at ICEID 2025.", 
     "date": "2025-11-22"},
     {"id": "4",
     "headline": "ICON•S TAIWAN CHAPTER 2025 ANNUAL CONFERENCE", 
     "content": "Our lab faculty member Prof. Shao-Man Lee served as one of the organizers of the ICON•S Taiwan Chapter 2025 Annual Conference.",
     "date": "2025-12-25"},
     {"id": "5",
     "headline": "New Challenges to AI and Copyright",
     "content": "Our lab faculty member, Prof. Shao-Man Lee, has invited Prof. Tzu-I Lee, Assistant Professor at the Graduate Institute of Patent, National Taiwan University of Science and Technology (NTUST), to deliver a talk.",
     "date": "2026-04-24"},
     {"id": "6",
     "headline": "Book of the Year Prize 2025 — International Forum on the Future of Constitutionalism",
     "content": "The book \"Judicial Bricolage: The Use of Foreign Precedents by Constitutional Judges in the 21st Century\" (Hart Publishing, eds. Tania Groppi, Marie-Claire Ponthoreau, and Irene Spigno), in which Prof. Shao-Man Lee co-authored Chapter 13 with Prof. Wen-Chen Chang, has been awarded the Book of the Year Prize 2025 by the International Forum on the Future of Constitutionalism, receiving 68% of the final round vote.",
     "date": "2026-03-23"}
]